{
  "openbrick": "1.0",
  "kind": "fit",
  "id": "fixture-calibrated",
  "credit": {
    "author": "OpenBrick3D contributors"
  },
  "process": "fdm-0.4",
  "printer": "Any printer",
  "nozzleMm": 0.4,
  "material": {
    "type": "PLA"
  },
  "intent": "fits-itself",
  "offsetsMm": {
    "studDiameter": 0.0,
    "tubeInnerDiameter": 0.0,
    "tubeOuterDiameter": 0.0,
    "ribDepth": 0.0,
    "pinDiameter": 0.0,
    "horizontalHoleDiameter": 0.0,
    "axleHole": 0.0,
    "barDiameter": 0.0,
    "clipOpening": 0.0,
    "firstLayerChamfer": 0.0
  },
  "calibration": {
    "couponVersion": 1,
    "chosenCells": {
      "stud": 4.8,
      "tube": 4.95
    },
    "date": "2026-10-28",
    "pullTestN": null
  }
}
