{
  "openbrick": "1.1",
  "kind": "fit",
  "id": "fixture-pocket-set",
  "credit": {
    "author": "OpenBrick3D contributors"
  },
  "process": "fdm-0.4",
  "printer": "Any printer",
  "nozzleMm": 0.4,
  "material": {
    "type": "PLA"
  },
  "intent": "fits-itself",
  "offsetsMm": {
    "studDiameter": 0.0,
    "tubeInnerDiameter": 0.0,
    "tubeOuterDiameter": 0.136,
    "ribDepth": 0.0,
    "pinDiameter": 0.0,
    "horizontalHoleDiameter": 0.0,
    "axleHole": 0.0,
    "barDiameter": 0.0,
    "clipOpening": 0.0,
    "firstLayerChamfer": 0.0
  },
  "calibration": {
    "couponVersion": 1,
    "pocketSet": "cross",
    "chosenCells": {
      "pocketTubeOD": 6.65,
      "pocketRib": 0.3
    },
    "date": "2026-10-28"
  },
  "notes": "A 1.1 document: calibration.pocketSet, added in 1.1, names the pocket set of the printed coupon; the two pocket cells are one pocket of it."
}
